{
  "editorial_package_id": "ep_a1b2c3d4e5f60708",
  "ingested_content_id": "ic_a1b2c3d4e5f60708",
  "status": "generated",
  "primary_headline": "Why Local Businesses Need a Digital Marketing Strategy in 2026",
  "supporting_headline": "A practical look at why local businesses need a digital marketing strategy in 2026",
  "executive_summary": "Local businesses across every sector are discovering that a coherent digital marketing strategy is no longer optional. This article explores the three pillars of sustainable growth: search visibility, social proof, and content consistency.",
  "core_message": "A coherent digital marketing strategy is no longer optional for local businesses.",
  "primary_audience": "Owners and marketing leads at small and mid-sized local businesses",
  "primary_problem": "Marketing activity is scattered and inconsistent rather than a repeatable system",
  "desired_outcome": "The reader adopts a structured, three-pillar approach to digital marketing",
  "key_insights": [
    "Search visibility matters because most buying journeys begin with a search engine query.",
    "Social proof compounds trust in a way advertising alone cannot buy.",
    "Content consistency is rewarded by both algorithms and audiences over time."
  ],
  "pull_quotes": [
    "A coherent digital marketing strategy is no longer optional.",
    "Scattered marketing activity becomes a repeatable system that compounds over time."
  ],
  "call_to_action": "Learn more about building a digital marketing strategy",
  "keywords": [
    "digital marketing",
    "local business",
    "search visibility",
    "social proof",
    "content consistency"
  ],
  "seo_title": "Why Local Businesses Need a Digital Marketing Strategy in 2026",
  "seo_description": "Local businesses are discovering that a coherent digital marketing strategy built on search visibility, social proof, and consistency is no longer optional.",
  "suggested_hashtags": [
    "digitalmarketing",
    "localbusiness",
    "seo",
    "contentmarketing"
  ],
  "editorial_themes": [
    "digital marketing strategy",
    "small business growth"
  ],
  "content_categories": [
    "content-marketing",
    "small-business"
  ],
  "generated_at": "2026-08-07T11:00:00.000Z",
  "llm_model": "mock-editorial-analysis-provider-v1",
  "prompt_version": "editorial-package.v2",
  "schema_version": "1.0",
  "checksum": "64c01d6d785f0d24dcbcafc8147e8fded602a702ac52129570607c9f1163b6f2"
}
